{
  "abstract": {
    "bitwise_probabilities": [
      1.0,
      1.0,
      1.0,
      1.0,
      1.0,
      1.0,
      1.0,
      1.0,
      1.0,
      1.0,
      1.0,
      1.0,
      1.0,
      1.0,
      1.0,
      1.0,
      1.0,
      1.0,
      1.0,
      1.0,
      1.0,
      1.0,
      1.0,
      1.0,
      1.0,
      1.0,
      1.0,
      1.0,
      1.0,
      1.0,
      1.0,
      1.0,
      1.0,
      1.0,
      1.0,
      1.0,
      1.0,
      1.0,
      1.0,
      1.0,
      1.0,
      1.0,
      1.0,
      1.0,
      1.0,
      1.0,
      1.0,
      1.0,
      1.0,
      1.0
    ],
    "elapsed_seconds": 0.4015043580002384,
    "judgment": "satisfied",
    "max_execution_bytes": 4032,
    "max_execution_mib": 0.00384521484375,
    "max_state_bytes": 4032,
    "max_state_mib": 0.00384521484375,
    "max_transition_bytes": 4032,
    "max_transition_mib": 0.00384521484375,
    "probability": 1.0,
    "threshold": 0.999999
  },
  "assertion_kind": "probability",
  "assertion_name": "adder_output_probability",
  "comparison": {
    "abstract_ideal_pure_lower_bound": {
      "max_execution_bytes": 1632,
      "max_execution_mib": 0.001556396484375,
      "max_state_bytes": 1632,
      "max_state_mib": 0.001556396484375,
      "max_transition_bytes": 1632,
      "max_transition_mib": 0.001556396484375
    },
    "full_execution": {
      "density_matrix_bytes": 20282409603651670423947251286016,
      "density_matrix_mib": 1.9342813113834067e+25,
      "qubit_count": 50,
      "statevector_bytes": 18014398509481984,
      "statevector_mib": 17179869184.0,
      "time_benchmark": {
        "cutoff_qubits": 22,
        "mode": "skipped",
        "reason": "qubit count exceeds automatic timing cutoff"
      }
    }
  },
  "concrete": {
    "reason": "Concrete backend disabled by default; pass --run-concrete to enable it.",
    "status": "skipped"
  },
  "model_path": "experiment_data/models/Adder/adder_50.qmodel",
  "program_name": "adder_50",
  "reconstruction_mode": "trusted",
  "run_concrete": false,
  "total_elapsed_seconds": 2.9338966849991266
}
