{
  "abstract": {
    "bitwise_probabilities": [
      0.9978306649641114,
      0.9971429214393359,
      0.9996083222207074,
      0.9995898875883741,
      0.9995342792333473,
      0.999168085533974,
      0.9980125202956757,
      0.9973373425102886,
      0.9997688127833887,
      0.9997638776008552,
      0.9997371260297335,
      0.9995887838441934,
      0.9979894308508348,
      0.9978194869618923,
      0.9971314716557872,
      0.9995962648620583,
      0.9995778716798166,
      0.9995214746264848,
      0.9991484256551053,
      0.9978195060375553,
      0.9971314909360999,
      0.9995962867413744,
      0.9995778928587986,
      0.9995214964284338,
      0.9991484542306441,
      0.9978199730462965,
      0.9971319646222634,
      0.9995968147084989,
      0.9995784072133252,
      0.9995220297398866,
      0.9991491828975763,
      0.997830664964122,
      0.9971429214393468,
      0.9996083222207187,
      0.999589887588386,
      0.9995342792333595,
      0.9991680855339867,
      0.9980125202956883,
      0.9973373425103013,
      0.999768812783401,
      0.9997638776008678,
      0.9997371260297461,
      0.9995887838442059,
      0.9979894308508486,
      0.9978194869619064,
      0.9971314716558014,
      0.9995962648620726,
      0.9995778716798307,
      0.9995214746264989,
      0.9991484256551195,
      0.9978195060376024,
      0.9971314909361472,
      0.9995962867414269,
      0.9995778928588498,
      0.999521496428486,
      0.9991484542307076,
      0.9978199730471933,
      0.997131964623167,
      0.9995968147095377,
      0.9995784072143248,
      0.9995220297409056,
      0.9991491828988623,
      0.9978306649873847,
      0.9971429214628168,
      0.9996083222473446,
      0.9995898876142565,
      0.9995342792602301,
      0.9991680855691759,
      0.998012520832626,
      0.9973373430517681,
      0.9997688134291426,
      0.9997638782039721,
      0.9997371266137491,
      0.9995887845279343,
      0.9979894497569614,
      0.9978195060375773,
      0.997131490936122,
      0.9995962867413964,
      0.9995778928588208,
      0.9995214964284558,
      0.9991484542306663,
      0.9978199730463189,
      0.9971319646222854,
      0.9995968147085212,
      0.9995784072133477,
      0.999522029739909,
      0.9991491828975985,
      0.9978306649641444,
      0.9971429214393692,
      0.9996083222207414,
      0.9995898875884086,
      0.9995342792333821,
      0.999168085534009,
      0.9980125202957125,
      0.9973373425103255,
      0.999768812783426,
      0.9997638776008926,
      0.9997371260297706,
      0.9995887838442308,
      0.997989430850945,
      0.9978194869620032,
      0.997131471655899,
      0.9995962648621814,
      0.9995778716799366,
      0.9995214746266068,
      0.999148425655251,
      0.9978195060395445,
      0.997131490938106,
      0.9995962867436697,
      0.9995778928610141,
      0.9995214964307043,
      0.9991484542335364,
      0.9978199730959472,
      0.9971319646723431,
      0.9995968147661101,
      0.9995784072687481,
      0.9995220297964351,
      0.9991491829692762,
      0.9978306662648048,
      0.9971429227519967,
      0.9996083237082998,
      0.9995898890341218,
      0.999534280735206,
      0.9991680875061046,
      0.9980125502665208,
      0.9973373727588636,
      0.9997688486629727,
      0.9997639111804404,
      0.9997371586618568,
      0.9995888224040445,
      0.9979904650121496,
      0.9978205311345236,
      0.9971325302076338,
      0.9995974477945878,
      0.999579023061861,
      0.9995226672658571,
      0.9991500455497113,
      0.9978436419101104,
      0.9971561852063393,
      0.9996224765278541,
      0.9996039104013167,
      0.9995491193153998,
      0.9991902574505799,
      0.9982544283883942,
      0.997592363336094,
      0.999999999999996,
      0.9999999999999966,
      0.999999999999997,
      0.9999999999999974,
      0.999999999999998
    ],
    "elapsed_seconds": 5.4569353059998775,
    "judgment": "satisfied",
    "max_execution_bytes": 74752,
    "max_execution_mib": 0.0712890625,
    "max_state_bytes": 25664,
    "max_state_mib": 0.02447509765625,
    "max_transition_bytes": 74752,
    "max_transition_mib": 0.0712890625,
    "probability": 0.9971314716557872,
    "threshold": 0.997
  },
  "assertion_kind": "probability",
  "assertion_name": "recover_target_bits",
  "comparison": {
    "abstract_ideal_pure_lower_bound": {
      "max_execution_bytes": 5632,
      "max_execution_mib": 0.00537109375,
      "max_state_bytes": 5152,
      "max_state_mib": 0.004913330078125,
      "max_transition_bytes": 5632,
      "max_transition_mib": 0.00537109375
    },
    "full_execution": {
      "density_matrix_bytes": 32592575621351777380295131014550050576823494298654980010178247189670100796213387298934358016,
      "density_matrix_mib": 3.1082702275611665e+85,
      "qubit_count": 150,
      "statevector_bytes": 22835963083295358096932575511191922182123945984,
      "statevector_mib": 2.1778071482940062e+40,
      "time_benchmark": {
        "cutoff_qubits": 22,
        "mode": "skipped",
        "reason": "qubit count exceeds automatic timing cutoff"
      }
    }
  },
  "concrete": {
    "reason": "Concrete backend disabled by default; pass --run-concrete to enable it.",
    "status": "skipped"
  },
  "model_path": "experiment_data/models/IQFT/iqft_150_w5.qmodel",
  "program_name": "iqft_150_w5",
  "reconstruction_mode": "trusted",
  "run_concrete": false,
  "total_elapsed_seconds": 16.32935019599995
}
