{
  "abstract": {
    "elapsed_seconds": 100.331772193,
    "judgment": "satisfied",
    "max_execution_bytes": 4203328,
    "max_execution_mib": 4.00860595703125,
    "max_state_bytes": 4203328,
    "max_state_mib": 4.00860595703125,
    "max_transition_bytes": 4203328,
    "max_transition_mib": 4.00860595703125,
    "probability": 0.9991823155432855,
    "threshold": 0.99
  },
  "assertion_kind": "probability",
  "assertion_name": "marked_subspace_probability",
  "comparison": {
    "abstract_ideal_pure_lower_bound": {
      "max_execution_bytes": 12704,
      "max_execution_mib": 0.012115478515625,
      "max_state_bytes": 12704,
      "max_state_mib": 0.012115478515625,
      "max_transition_bytes": 12704,
      "max_transition_mib": 0.012115478515625
    },
    "full_execution": {
      "density_matrix_bytes": 32592575621351777380295131014550050576823494298654980010178247189670100796213387298934358016,
      "density_matrix_mib": 3.1082702275611665e+85,
      "qubit_count": 150,
      "statevector_bytes": 22835963083295358096932575511191922182123945984,
      "statevector_mib": 2.1778071482940062e+40,
      "time_benchmark": {
        "cutoff_qubits": 22,
        "mode": "skipped",
        "reason": "qubit count exceeds automatic timing cutoff"
      }
    }
  },
  "concrete": {
    "reason": "Concrete backend disabled by default; pass --run-concrete to enable it.",
    "status": "skipped"
  },
  "model_path": "experiment_data/models/Grover/grover_150.qmodel",
  "program_name": "grover_150",
  "reconstruction_mode": "trusted",
  "run_concrete": false,
  "total_elapsed_seconds": 104.83002323000005
}
